"№","Web-Site","Name","Info","Time"
"0","Datacamp.com","Introduction to Python ","          Master the basics of data analysis in Python. Expand your skillset by learning scientific computing with numpy.         ","4 hours"
"1","Datacamp.com","Introduction to SQL ","          Master the basics of querying tables in relational databases such as MySQL, SQL Server, and PostgreSQL.         ","4 hours"
"2","Datacamp.com","Introduction to R ","          Master the basics of data analysis by manipulating common data structures such as vectors, matrices, and data frames.         ","4 hours"
"3","Datacamp.com","Data Science for Everyone ","          An introduction to data science with no coding involved.         ","2 hours"
"4","Datacamp.com","Intermediate Python ","          Level up your data science skills by creating visualizations using Matplotlib and manipulating DataFrames with pandas.         ","4 hours"
"5","Datacamp.com","Joining Data in SQL ","          Join two or three tables together into one, combine tables using set theory, and work with subqueries in PostgreSQL.         ","5 hours"
"6","Datacamp.com","Introduction to Data Science in Python ","          Dive into data science using Python and learn how to effectively analyze and visualize your data.         ","4 hours"
"7","Datacamp.com","Data Manipulation with pandas ","          Use the world’s most popular Python data science package to manipulate data and calculate summary statistics.         ","4 hours"
"8","Datacamp.com","Intermediate R ","          Continue your journey to becoming an R ninja by learning about conditional statements, loops, and vector functions.         ","6 hours"
"9","Datacamp.com","Introduction to Power BI ","          Gain a 360° overview of how to explore and use Power BI to build impactful reports.         ","6 hours"
"10","Datacamp.com","Supervised Learning with scikit learn","           Learn how to build and tune predictive models and evaluate how well they'll perform on unseen data.","4 hours"
"11","Datacamp.com","Introduction to the Tidyverse ","          Get started on the path to exploring and visualizing your own data with the tidyverse, a powerful and popular collection of data science tools within R.         ","4 hours"
"12","Datacamp.com","Python Data Science Toolbox (Part 1) ","          Learn the art of writing your own functions in Python, as well as key concepts like scoping and error handling.         ","3 hours"
"13","Datacamp.com","Python Data Science Toolbox (Part 2) ","          Continue to build your modern Data Science skills by learning about iterators and list comprehensions.         ","4 hours"
"14","Datacamp.com","Data Engineering for Everyone ","          Discover how data engineers lay the groundwork that makes data science possible. No coding involved!         ","2 hours"
"15","Datacamp.com","Introduction to Tableau ","          Get started with Tableau, a widely used business intelligence (BI) and analytics software to explore, visualize, and securely share data.         ","6 hours"
"16","Datacamp.com","Machine Learning for Everyone ","          An introduction to machine learning with no coding involved.         ","2 hours"
"17","Datacamp.com","Intermediate SQL ","          Master the complex SQL queries necessary to answer a wide variety of data science questions and prepare robust data sets for analysis in PostgreSQL.         ","4 hours"
"18","Datacamp.com","Introduction to Data Visualization with ggplot2 ","          Learn to produce meaningful and beautiful data visualizations with ggplot2 by understanding the grammar of graphics.         ","4 hours"
"19","Datacamp.com","Introduction to Data Visualization with Matplotlib ","          Learn how to create, customize, and share data visualizations using Matplotlib.         ","4 hours"
"20","Datacamp.com","Joining Data with pandas ","          Learn to combine data from multiple tables by joining data together using pandas.         ","4 hours"
"21","Datacamp.com","Introduction to Importing Data in Python ","          Learn to import data into Python from various sources, such as Excel, SQL, SAS and right from the web.         ","3 hours"
"22","Datacamp.com","Introduction to SQL Server ","          Become proficient at using SQL Server to perform common data manipulation tasks.         ","4 hours"
"23","Datacamp.com","Data Manipulation with dplyr  ","          Learn to transform and manipulate your data using dplyr.          ","4 hours"
"24","Datacamp.com","Data Analysis in Excel ","          Learn how to analyze data in Excel.         ","4 hours"
"25","Datacamp.com","Introduction to Statistics in R ","          Grow your statistical skills and learn how to collect, analyze, and draw accurate conclusions from data.         ","4 hours"
"26","Datacamp.com","Cleaning Data in Python ","          Learn to diagnose and treat dirty data and develop the skills needed to transform your raw data into accurate insights!          ","4 hours"
"27","Datacamp.com","Statistical Thinking in Python (Part 1) ","          Build the foundation you need to think statistically and to speak the language of your data.         ","3 hours"
"28","Datacamp.com","Writing Efficient Python Code ","          Learn to write efficient code that executes quickly and allocates resources skillfully to avoid unnecessary overhead.         ","4 hours"
"29","Datacamp.com","Introduction to Data Visualization with Seaborn ","          Learn how to create informative and attractive visualizations in Python using the Seaborn library.         ","4 hours"
"30","Datacamp.com","Unsupervised Learning in Python ","          Learn how to cluster, transform, visualize, and extract insights from unlabeled datasets using scikit learn and scipy.","4 hours"
"31","Datacamp.com","Introduction to Relational Databases in SQL ","          Learn how to create one of the most efficient ways of storing data   relational databases! ","4 hours"
"32","Datacamp.com","Intermediate Importing Data in Python ","          Improve your Python data importing skills and learn to work with web and API data.         ","2 hours"
"33","Datacamp.com","Exploratory Data Analysis in Python ","          Learn how to explore, visualize, and extract insights from data.          ","4 hours"
"34","Datacamp.com","Introduction to PySpark ","          Learn to implement distributed data management and machine learning in Spark using the PySpark package.","4 hours"
"35","Datacamp.com","Introduction to Importing Data in R ","          In this course, you will learn to read CSV, XLS, and text files in R using tools like readxl and data.table.         ","3 hours"
"36","Datacamp.com","Object Oriented Programming in Python","           Dive in and learn how to create classes and leverage inheritance and polymorphism to reuse and optimize code.","4 hours"
"37","Datacamp.com","Introduction to Git ","          This course is an introduction to version control with Git for data scientists.          ","4 hours"
"38","Datacamp.com","Writing Functions in Python ","          Learn to use best practices to write maintainable, reusable, complex functions with good documentation.         ","4 hours"
"39","Datacamp.com","Data Analysis in Spreadsheets ","          Learn how to analyze data with spreadsheets using functions such as SUM(), AVERAGE(), and VLOOKUP().         ","3 hours"
"40","Datacamp.com","Introduction to Deep Learning in Python ","          Learn the fundamentals of neural networks and how to build deep learning models using Keras 2.0.         ","4 hours"
"41","Datacamp.com","Machine Learning with Tree Based Models in Python","           In this course, you'll learn how to use tree",""
"42","Datacamp.com","Exploratory Data Analysis in SQL ","          Learn how to explore what's available in a database: the tables, relationships between them, and data stored in them.         ","4 hours"
"43","Datacamp.com","Introduction to Data Engineering ","          Learn about the world of data engineering with an overview of all its relevant topics and tools!         ","4 hours"
"44","Datacamp.com","Introduction to Shell ","          The Unix command line helps users combine existing programs in new ways, automate repetitive tasks, and run programs on clusters and clouds.          ","4 hours"
"45","Datacamp.com","DAX in Power BI ","          Data Analysis Expressions (DAX) allow you to take your Power BI skills to the next level by writing custom functions.         ","6 hours"
"46","Datacamp.com","Cleaning Data in R ","          Develop the skills you need to go from raw data to awesome insights as quickly and accurately as possible.         ","4 hours"
"47","Datacamp.com","Introduction to Natural Language Processing in Python ","          Learn fundamental natural language processing techniques using Python and how to apply them to extract insights from real world text data.","4 hours"
"48","Datacamp.com","Cloud Computing for Everyone ","          A non coding introduction to the world of cloud computing.","2 hours"
"49","Datacamp.com","Streamlined Data Ingestion with pandas ","          Learn to acquire data from common file formats and systems such as CSV files, spreadsheets, JSON, SQL databases, and APIs.         ","4 hours"
"50","Datacamp.com","Exploring the Evolution of Lego ","          In this project, we will use data manipulation skills to zoom in on a time when Lego explored a new direction for their toy line! ","45 minutes"
"51","Datacamp.com","Name Game: Gender Prediction using Sound ","          Analyze the gender distribution of children's book writers and use sound to match names to gender. ","45 minutes"
"52","Datacamp.com","","           Visualize the rise of COVID",""
"53","Datacamp.com","Exploring the Bitcoin Cryptocurrency Market ","          You will explore the market capitalization of Bitcoin and other cryptocurrencies. ","45 minutes"
"54","Datacamp.com","Text Mining America's Toughest Game Show ","          Use text mining to analyze Jeopardy! data.  ","45 minutes"
"55","Datacamp.com","Wrangling and Visualizing Musical Data ","          Wrangle and visualize musical data to find common chords and compare the styles of different artists. ","45 minutes"
"56","Datacamp.com","Real time Insights from Social Media Data","           Learn to analyze Twitter data and do a deep dive into a hot trend.",""
"57","Datacamp.com","A Network Analysis of Game of Thrones ","          Analyze the network of characters in Game of Thrones and how it changes over the course of the books. ","45 minutes"
"58","Datacamp.com","Importing and Cleaning Data ","          Apply your importing and data cleaning skills to real world soccer data.",""
"59","Datacamp.com","Analyze International Debt Statistics ","          Write SQL queries to answer interesting questions about international debt using data from The World Bank. ","45 minutes"
"60","Datacamp.com","Disney Movies and Box Office Success ","          Explore Disney movie data, then build a linear regression model to predict box office success. ","45 minutes"
"61","Datacamp.com","Exploring the Kaggle Data Science Survey ","          Discover the top tools Kaggle participants use for data science and machine learning.  ","45 minutes"
"62","Datacamp.com","Modeling the Volatility of US Bond Yields ","          Discover how the US bond yields behave using descriptive statistics and advanced modeling. ","45 minutes"
"63","Datacamp.com","Analyze Your Runkeeper Fitness Data ","          Import, clean, and analyze seven years worth of training data tracked on the Runkeeper app. ","45 minutes"
"64","Datacamp.com","What Makes a Pokémon Legendary? ","          Use tree based machine learning methods to identify the characteristics of legendary Pokémon.",""
"65","Datacamp.com","Kidney Stones and Simpson's Paradox ","          Use logistic regression to determine which treatment procedure is more effective for kidney stone removal. ","45 minutes"
"66","Datacamp.com","Comparing Cosmetics by Ingredients ","          Process ingredient lists for cosmetics on Sephora then visualize similarity using t SNE and Bokeh.",""
"67","Datacamp.com","TV, Halftime Shows, and the Big Game ","          Load, clean, and explore Super Bowl data in the age of soaring ad costs and flashy halftime shows. ","45 minutes"
"68","Datacamp.com","Analyzing TV Data ","          Use data manipulation and visualization to explore one of two different television broadcast datasets: The Super Bowl and hit sitcom The Office! ","45 minutes"
"69","Datacamp.com","Bad Passwords and the NIST Guidelines ","          Check what passwords fail to conform to the National Institute of Standards and Technology password guidelines. ","45 minutes"
"70","Datacamp.com","Health Survey Data Analysis of BMI ","          Analyze health survey data to determine how BMI is associated with physical activity and smoking. ","45 minutes"
"71","Datacamp.com","Trends in Maryland Crime Rates ","          Apply hierarchical and mixed effect models to analyze Maryland crime rates.",""
"72","Datacamp.com","Are You Ready for the Zombie Apocalypse? ","          Use your logistic regression skills to protect people from becoming zombies!  ","45 minutes"
"73","Datacamp.com","The Impact of Climate Change on Birds ","           Predict the impact of climate change on bird distributions using spatial data and machine learning.",""
"74","Datacamp.com","Risk and Returns: The Sharpe Ratio ","          Use pandas to calculate and compare profitability and risk of different investments using the Sharpe Ratio. ","45 minutes"
"75","Datacamp.com","Find Movie Similarity from Plot Summaries ","          Use NLP and clustering on movie plot summaries from IMDb and Wikipedia to quantify movie similarity. ","45 minutes"
"76","Datacamp.com","Give Life: Predict Blood Donations ","          Build a binary classifier to predict if a blood donor is likely to donate again. ","45 minutes"
"77","Datacamp.com","Clustering Bustabit Gambling Behavior ","          Use cluster analysis to glean insights into cryptocurrency gambling behavior. ","45 minutes"
"78","Datacamp.com","Planning Public Policy in Argentina ","          Apply unsupervised learning techniques to help plan an education program in Argentina. ","45 minutes"
"79","Datacamp.com","Phyllotaxis: Draw Flowers Using Mathematics ","          Use R to make art and create imaginary flowers inspired by nature. ","45 minutes"
"80","Datacamp.com","The Android App Market on Google Play ","          Load, clean, and visualize scraped Google Play Store data to gain insights into the Android app market. ","45 minutes"
"81","Datacamp.com","Data Science for Social Good: Crime Study ","          Use data science to catch criminals, plus find new ways to volunteer personal time for social good. ","45 minutes"
"82","Datacamp.com","Extract Stock Sentiment from News Headlines ","          Scrape news headlines for FB and TSLA then apply sentiment analysis to generate investment insight. ","45 minutes"
"83","Datacamp.com","Book Recommendations from Charles Darwin ","          Build a book recommendation system using NLP and the text of books like ""On the Origin of Species."" ","45 minutes"
"84","Datacamp.com","Degrees That Pay You Back ","          Explore the salary potential of college majors with a k means cluster analysis.",""
"85","Datacamp.com","Introduction to DataCamp Projects ","          If you've never done a DataCamp project, this is the place to start! ","30 minutes"
"86","Datacamp.com","Gender Bias in Graduate Admissions ","          Analyze admissions data from UC Berkeley and find out if the university was biased against women. ","45 minutes"
"87","Datacamp.com","Going Down to South Park: A Text Analysis ","          Analyze the dialog and IMDB ratings of 287 South Park episodes. Warning: contains explicit language. ","45 minutes"
"88","Datacamp.com","Predicting Credit Card Approvals ","          Build a machine learning model to predict if a credit card application will get approved.  ","45 minutes"
"89","Datacamp.com","Naïve Bees: Deep Learning with Images ","          Build a deep learning model that can automatically detect honey bees and bumble bees in images. ","45 minutes"
"90","Datacamp.com","Clustering Heart Disease Patient Data ","          Experiment with clustering algorithms to help doctors inform treatment for heart disease patients.         ","45 minutes"
"91","Datacamp.com","Where Are the Fishes? ","          Explore acoustic backscatter data to find fish in the U.S. Atlantic Ocean.  ","45 minutes"
"92","Datacamp.com","Comparing Search Interest with Google Trends ","          Manipulate and plot time series data from Google Trends to analyze changes in search interest over time. ","45 minutes"
"93","Datacamp.com","Functions for Food Price Forecasts ","          Write functions to forecast time series of food prices in Rwanda. ","45 minutes"
"94","Datacamp.com","A Text Analysis of Trump's Tweets ","          Apply text mining to Donald Trump's tweets to confirm if he writes the (angrier) Android half.  ","45 minutes"
"95","Datacamp.com","ASL Recognition with Deep Learning ","          Build a convolutional neural network to classify images of letters from American Sign Language. ","45 minutes"
"96","Datacamp.com","Which Debts Are Worth the Bank's Effort? ","          Play bank data scientist and use regression discontinuity to see which debts are worth collecting. ","45 minutes"
"97","Datacamp.com","Predict Taxi Fares with Random Forests ","          Use regression trees and random forests to find places where New York taxi drivers earn the most.  ","45 minutes"
"98","Datacamp.com","Dr. Semmelweis and the Discovery of Handwashing ","          Reanalyse the data behind one of the most important discoveries of modern medicine: handwashing. ","60 minutes"
"99","Datacamp.com","Drunken Datetimes in Ames, Iowa ","          Apply your skills from ""Working with Dates and Times in R"" to breathalyzer data from Ames, Iowa.  ","45 minutes"
"100","Open_edu","A question of ethics: right or wrong?","Intermediate","7"
"101","Open_edu","Accessibility and inclusion in digital health","Introductory","4"
"102","Open_edu","Accessibility of eLearning","Advanced","15"
"103","Open_edu","Active, healthy lifestyles","Introductory","10"
"104","Open_edu","Am I ready to be a distance learner?","Introductory","3"
"105","Open_edu","An introduction to data and information","Introductory","20"
"106","Open_edu","An introduction to data and information in health and social care","Introductory","12"
"107","Open_edu","An introduction to death, dying and grief","Intermediate","7"
"108","Open_edu","An introduction to design engineering","Introductory","10"
"109","Open_edu","An introduction to social work","Introductory","15"
"110","Open_edu","An introduction to social work in Wales","Introductory","10"
"111","Open_edu","Astudio meddygaeth yn ddwyieithog","Beginner","1"
"112","Open_edu","Attachment in the early years","Intermediate","6"
"113","Open_edu","Becoming a critical social work practitioner","Advanced","15"
"114","Open_edu","Beth amdana i? Cwrs datblygiad personol ar gyfer gofalwyr yng Nghymru","Beginner","5"
"115","Open_edu","Business communication: writing a SWOT analysis","Introductory","8"
"116","Open_edu","Campaigns and organisations","Advanced","2"
"117","Open_edu","Caring for adults","Beginner","15"
"118","Open_edu","Challenging ideas in mental health","Intermediate","8"
"119","Open_edu","Childhood in crisis?","Intermediate","6"
"120","Open_edu","Childhood in the digital age","Introductory","12"
"121","Open_edu","Children and young people’s participation","Advanced","12"
"122","Open_edu","Coaching others to coach","Intermediate","24"
"123","Open_edu","Collective leadership","Introductory","6"
"124","Open_edu","Commercial awareness","Introductory","2"
"125","Open_edu","Communication and working relationships in sport and fitness","Introductory","24"
"126","Open_edu","Communication, management and your own context","Advanced","8"
"127","Open_edu","Completing the project","Advanced","8"
"128","Open_edu","Contemporary issues in managing","Introductory","8"
"129","Open_edu","Conversations and interviews","Intermediate","5"
"130","Open_edu","Coping in isolation: Time to Think","Introductory","6"
"131","Open_edu","Cyflwyniad i waith cymdeithasol","Beginner","15"
"132","Open_edu","Cyflwyniad i waith cymdeithasol yng Nghymru","Beginner","10"
"133","Open_edu","Death and medicine: Postponement and promise","Intermediate","1"
"134","Open_edu","Dechrau gyda seicoleg","Beginner","5"
"135","Open_edu","Decision trees and dealing with uncertainty","Advanced","5"
"136","Open_edu","Design thinking","Introductory","10"
"137","Open_edu","Developing career resilience","Introductory","24"
"138","Open_edu","Developing high trust work relationships","Intermediate","2"
"139","Open_edu","Difference and challenge in teams","Introductory","2"
"140","Open_edu","Digital innovation in social care and social work","Introductory","4"
"141","Open_edu","Digital skills: succeeding in a digital world","Introductory","24"
"142","Open_edu","Discovering management","Advanced","15"
"143","Open_edu","Diversity and difference in communication","Introductory","16"
"144","Open_edu","Drug development process: combating pain","Advanced","2"
"145","Open_edu","Eating to win: activity, diet and weight control","Introductory","6"
"146","Open_edu","Effective communication in the workplace","Introductory","24"
"147","Open_edu","Effective ways of displaying information","Introductory","6"
"148","Open_edu","Emotions and emotional disorders","Intermediate","6"
"149","Open_edu","Employee engagement","Advanced","10"
"150","Open_edu","Employment relations and employee engagement","Advanced","10"
"151","Open_edu","Entrepreneurial behaviour","Advanced","20"
"152","Open_edu","Entrepreneurial impressions – reflection","Advanced","7"
"153","Open_edu","Entrepreneurship – from ideas to reality","Intermediate","24"
"154","Open_edu","Essay and report writing skills","Introductory","15"
"155","Open_edu","Exercise and mental health","Intermediate","2"
"156","Open_edu","Exploring anxiety","Advanced","9"
"157","Open_edu","Exploring career mentoring and coaching","Introductory","24"
"158","Open_edu","Exploring depression","Advanced","7"
"159","Open_edu","Exploring family health","Introductory","8"
"160","Open_edu","Exploring health: is your lifestyle really to blame?","Intermediate","4"
"161","Open_edu","Exploring issues in women's health","Intermediate","3"
"162","Open_edu","Exploring learning disabilities: supporting belonging","Introductory","24"
"163","Open_edu","Exploring sport coaching and psychology","Introductory","24"
"164","Open_edu","Exploring sport online: Athletes and efficient hearts","Introductory","5"
"165","Open_edu","Exploring the psychological aspects of sport injury","Intermediate","24"
"166","Open_edu","Exploring the relationship between anxiety and depression","Advanced","3"
"167","Open_edu","Facilitating group discussions","Introductory","2"
"168","Open_edu","Financial accounting and reporting","Intermediate","12"
"169","Open_edu","Forensic psychology","Introductory","24"
"170","Open_edu","Forensic science and fingerprints","Introductory","10"
"171","Open_edu","Foundations for self-directed support in Scotland","Introductory","50"
"172","Open_edu","From sound to meaning: hearing, speech and language","Intermediate","12"
"173","Open_edu","Getting started with SPSS","Introductory","3"
"174","Open_edu","Gofalu am oedolion","Beginner","15"
"175","Open_edu","Grammar matters","Advanced","8"
"176","Open_edu","Groups and teamwork","Intermediate","20"
"177","Open_edu","Health and environment","Intermediate","12"
"178","Open_edu","Health and safety in the laboratory and field","Introductory","1"
"179","Open_edu","Homelessness and need","Intermediate","1"
"180","Open_edu","How teams work","Advanced","10"
"181","Open_edu","How to frame a business case","Intermediate","8"
"182","Open_edu","Identity in question","Introductory","12"
"183","Open_edu","Imaging in medicine","Advanced","15"
"184","Open_edu","Implementing the project","Advanced","8"
"185","Open_edu","Improving aerobic fitness","Introductory","2"
"186","Open_edu","Infection and immunity","Introductory","12"
"187","Open_edu","Information security","Advanced","10"
"188","Open_edu","Innovation in health and social care practice","Introductory","4"
"189","Open_edu","Innovation in health and social care: social and historical","Introductory","4"
"190","Open_edu","Innovation through representation","Advanced","15"
"191","Open_edu","International management: An institutional perspective","Advanced","15"
"192","Open_edu","Internships and other work experiences","Introductory","24"
"193","Open_edu","Interpreting data: Boxplots and tables","Intermediate","16"
"194","Open_edu","Interview with a social worker","Introductory","1"
"195","Open_edu","Introducing ageing","Introductory","11"
"196","Open_edu","Introducing computing and IT","Introductory","10"
"197","Open_edu","Introducing corporate finance","Advanced","20"
"198","Open_edu","Introducing healthcare improvement","Advanced","3"
"199","Open_edu","Introducing ICT systems","Introductory","9"
"200","Open_edu","Introducing public health","Intermediate","6"
"201","Open_edu","Introducing social work: a starter kit","Advanced","12"
"202","Open_edu","Introducing the voluntary sector","Introductory","24"
"203","Open_edu","Introduction to child psychology","Introductory","8"
"204","Open_edu","Investigating psychology","Intermediate","3"
"205","Open_edu","Issues in research with children and young people","Advanced","7"
"206","Open_edu","IT: Information","Introductory","20"
"207","Open_edu","Key skill assessment unit: Information technology","Introductory","50"
"208","Open_edu","Key skill assessment unit: Working with others","Introductory","50"
